{"docid_partnum": ["GUM_bio_holt", 0], "sentences": [{"docid_partnum": ["GUM_bio_holt", 0], "tokens": ["Listed", "at", "5", "feet", "10", "inches", "(", "1.78", "m", ")", "and", "180", "pounds", "(", "82", "kg", ")", ",", "Holt", "bats", "left", "-", "handed", "and", "throws", "right", "-", "handed", "."], "mentions": [[78, [2, 6]], [78, [7, 9]], [79, [11, 13]], [79, [14, 16]], [66, [18, 19]]], "sent_string": "Listed at 5 feet 10 inches ( 1.78 m ) and 180 pounds ( 82 kg ), Holt bats left-handed and throws right-handed.", "mentions_string": {"5 feet 10 inches": [78, [2, 6]], "1.78 m": [78, [7, 9]], "180 pounds": [79, [11, 13]], "82 kg": [79, [14, 16]], "Holt": [66, [18, 19]]}}, {"docid_partnum": ["GUM_bio_holt", 0], "tokens": ["He", "first", "played", "in", "MLB", "for", "the", "Pittsburgh", "Pirates", "in", "2012", ",", "but", "has", "played", "for", "the", "Red", "Sox", "every", "season", "since", "."], "mentions": [[66, [0, 1]], [18, [4, 5]], [83, [6, 9]], [84, [7, 8]], [85, [10, 11]], [68, [16, 19]], [88, [19, 22]]], "sent_string": "He first played in MLB for the Pittsburgh Pirates in 2012, but has played for the Red Sox every season since.", "mentions_string": {"He": [66, [0, 1]], "MLB": [18, [4, 5]], "the Pittsburgh Pirates": [83, [6, 9]], "Pittsburgh": [84, [7, 8]], "2012": [85, [10, 11]], "the Red Sox": [68, [16, 19]], "every season since": [88, [19, 22]]}}, {"docid_partnum": ["GUM_bio_holt", 0], "tokens": ["High", "school", "career"], "mentions": [[89, [0, 3]], [90, [0, 2]]], "sent_string": "High school career", "mentions_string": {"High school career": [89, [0, 3]], "High school": [90, [0, 2]]}}, {"docid_partnum": ["GUM_bio_holt", 0], "tokens": ["Holt", "graduated", "in", "2006", "from", "Stephenville", "High", "School", "in", "Texas", "."], "mentions": [[66, [0, 1]], [91, [3, 4]], [90, [5, 10]], [94, [5, 6]], [15, [9, 10]]], "sent_string": "Holt graduated in 2006 from Stephenville High School in Texas.", "mentions_string": {"Holt": [66, [0, 1]], "2006": [91, [3, 4]], "Stephenville High School in Texas": [90, [5, 10]], "Stephenville": [94, [5, 6]], "Texas": [15, [9, 10]]}}, {"docid_partnum": ["GUM_bio_holt", 0], "tokens": ["In", "2003", ",", "his", "freshman", "year", ",", "he", "made", "the", "District", "8", "-", "4A", "All", "-", "District", "baseball", "team", "despite", "batting", "just", ".227", ",", "and", "shared", "the", "league", "'s", "Newcomer", "of", "the", "Year", "award", ".", "[", "1", "]"], "mentions": [[95, [1, 2]], [95, [3, 6]], [66, [3, 4]], [66, [7, 8]], [101, [9, 19]], [102, [10, 14]], [103, [17, 18]], [105, [21, 23]], [106, [26, 34]], [107, [26, 29]], [108, [29, 33]], [95, [31, 33]], [109, [36, 37]]], "sent_string": "In 2003, his freshman year, he made the District 8-4A All-District baseball team despite batting just .227, and shared the league 's Newcomer of the Year award. [ 1 ]", "mentions_string": {"2003": [95, [1, 2]], "his freshman year": [95, [3, 6]], "his": [66, [3, 4]], "he": [66, [7, 8]], "the District 8-4A All-District baseball team": [101, [9, 19]], "District 8-4A": [102, [10, 14]], "baseball": [103, [17, 18]], "just .227": [105, [21, 23]], "the league 's Newcomer of the Year award": [106, [26, 34]], "the league 's": [107, [26, 29]], "Newcomer of the Year": [108, [29, 33]], "the Year": [95, [31, 33]], "1": [109, [36, 37]]}}, {"docid_partnum": ["GUM_bio_holt", 0], "tokens": ["Holt", "was", "a", "second", "-", "team", "All", "-", "District", "8", "-", "4A", "inclusion", "his", "sophomore", "year", ",", "batting", ".324", "for", "the", "season", ".", "[", "2", "]"], "mentions": [[66, [0, 1]], [112, [2, 13]], [102, [6, 12]], [113, [13, 16]], [112, [13, 14]], [114, [18, 19]], [117, [20, 22]], [118, [24, 25]]], "sent_string": "Holt was a second-team All-District 8-4A inclusion his sophomore year, batting .324 for the season. [ 2 ]", "mentions_string": {"Holt": [66, [0, 1]], "a second-team All-District 8-4A inclusion": [112, [2, 13]], "All-District 8-4A": [102, [6, 12]], "his sophomore year": [113, [13, 16]], "his": [112, [13, 14]], ".324": [114, [18, 19]], "the season": [117, [20, 22]], "2": [118, [24, 25]]}}, {"docid_partnum": ["GUM_bio_holt", 0], "tokens": ["In", "2005", ",", "Holt", "was", "named", "defensive", "player", "of", "the", "year", "in", "District", "6", "-", "4A", ",", "[", "3", "]", "and", "he", "earned", "all", "-", "district", "honors", "in", "2006", ",", "his", "senior", "year", ".", "[", "4", "]"], "mentions": [[119, [1, 2]], [112, [3, 4]], [112, [6, 11]], [119, [9, 11]], [123, [12, 16]], [124, [18, 19]], [112, [21, 22]], [127, [23, 27]], [91, [28, 29]], [91, [30, 33]], [112, [30, 31]], [129, [32, 33]], [130, [35, 36]]], "sent_string": "In 2005, Holt was named defensive player of the year in District 6-4A, [ 3 ] and he earned all-district honors in 2006, his senior year. [ 4 ]", "mentions_string": {"2005": [119, [1, 2]], "Holt": [112, [3, 4]], "defensive player of the year": [112, [6, 11]], "the year": [119, [9, 11]], "District 6-4A": [123, [12, 16]], "3": [124, [18, 19]], "he": [112, [21, 22]], "all-district honors": [127, [23, 27]], "2006": [91, [28, 29]], "his senior year": [91, [30, 33]], "his": [112, [30, 31]], "year": [129, [32, 33]], "4": [130, [35, 36]]}}], "doc_string": "Brock Holt Holt with the Boston Red Sox Boston Red Sox \u2013 No. 12 Second baseman / Shortstop / Outfielder Born : June 11, 1988 ( age 30 ) Fort Worth, Texas Bats : Left Throws : Right MLB debut September 1, 2012, for the Pittsburgh Pirates MLB statistics ( through September 20, 2018 ) Batting average .265 Home runs 19 Runs batted in 171 Teams Pittsburgh Pirates ( 2012 ) Boston Red Sox ( 2013 \u2013 present ) Career highlights and awards All-Star ( 2015 ) Hit for the cycle on June 16, 2015 World Series champion ( 2013 ) Brock Wyatt Holt ( born June 11, 1988 ) is an American professional baseball second baseman, shortstop and outfielder for the Boston Red Sox of Major League Baseball ( MLB ). While primarily used as an infielder, he has started in and played at every position for the Red Sox, except for pitcher and catcher. Listed at 5 feet 10 inches ( 1.78 m ) and 180 pounds ( 82 kg ), Holt bats left-handed and throws right-handed. He first played in MLB for the Pittsburgh Pirates in 2012, but has played for the Red Sox every season since. High school career Holt graduated in 2006 from Stephenville High School in Texas. In 2003, his freshman year, he made the District 8-4A All-District baseball team despite batting just .227, and shared the league 's Newcomer of the Year award. [ 1 ] Holt was a second-team All-District 8-4A inclusion his sophomore year, batting .324 for the season. [ 2 ] In 2005, Holt was named defensive player of the year in District 6-4A, [ 3 ] and he earned all-district honors in 2006, his senior year. [ 4 ] College career Holt attended Navarro College in 2007 and 2008. [ 5 ] After transferring to Rice University in 2009, he posted a .348 batting average with 12 home runs and 43 RBIs in 59 games for the Rice Owls. He also led the Owls with 67 runs scored and shared the team lead with 11 stolen bases. In the same season, he was named both to the All-NCAA Regional Team and the All-Silver Glove Trophy Series team. [ 6 ] Holt was drafted by the Pittsburgh Pirates with the club 's ninth round selection in the 2009 Major League Baseball Draft, one pick before his Rice teammate Ryan Berry. [ 7 ] Professional career Minor leagues Holt began his professional career with the Pittsburgh Pirates ' short season, Class-A affiliate, the State College Spikes, before advancing to the High-A Bradenton Marauders in 2010. His 2010 season was cut short due to injury to his medial collateral ligament, which required surgery. [ 8 ] He began the 2011 season with the Pirates ' Double-A affiliate, the Altoona Curve. On July 13, 2011, Holt was named the MVP of the Eastern League All-Star Game after hitting a two-run homer in the ninth inning. [ 9 ] Holt opened 2012 with Altoona and later joined Triple-A Indianapolis Indians. He was promoted to the Pittsburgh Pirates from the minors as the major league rosters expanded on September 1. Holt made his Major League debut on September 1, 2012. At the time of his promotion, he had hit a .322 average in 102 games with Altoona and .432 in 24 games for Indianapolis. [ 10 ] On September 4, against the Houston Astros, Holt became only the second Pirates player since 1900 to have a four-hit game within his first four career games in the majors. The only other Pirates player to have a four-hit game so early in his career was Jack Merson, who went 4-for-5 in his second major league game on September 15, 1951. [ 11 ] In 24 games, Holt batted .292 with a triple and 3 RBI. 2013 On December 26, 2012 he was traded to the Boston Red Sox ( along with Joel Hanrahan ) for Jerry Sands, Stolmy Pimentel, Mark Melancon, and Iv\u00e1n DeJes\u00fas, Jr.. [ 12 ] Holt started the 2013 season with the Triple-A Pawtucket Red Sox. He debuted for Boston after getting called up on July 6 in Anaheim. In 2013, Holt played in 26 games, hitting .203 with 11 RBI. Holt received his first championship ring when the Red Sox won the World Series over the St. Louis Cardinals in six games, despite not playing in the postseason. 2014 Holt again started 2014 in Triple-A, but was called up May 17 after an injury to Will Middlebrooks and hit leadoff for the rest of the season. On May 31, 2014, against the Tampa Bay Rays at Fenway Park, Holt hit his first Major League home run. On June 8, 2014, in order to allow Xander Bogaerts to play 3rd base, Holt moved to left field. He immediately impressed, making a sensational catch on the warning track to rob Ian Kinsler of a hit. On July 9, 2014, against the Chicago White Sox, Holt drove in Daniel Nava in the bottom of the 9th inning for the first walk-off hit of his career. [ 13 ] On June 1, 2015, while starting at first base for the first time in his career, Holt went 4-for-4 with four doubles, a walk, and two RBI against the Tampa Bay Rays to win 4 to 0. [ 14 ] By the end of the season, Holt had started games at every position except pitcher and catcher. [ 15 ]"}